{
  "schema_version": "1.0.0",
  "run_id": "run-2026-10-18-0a1b2c",
  "audit_id": "fixture",
  "method": "wcag-em-2.0",
  "algorithm": "diligent-sampler/1",
  "seed": "run-2026-10-18-0a1b2c",
  "prng": "diligent-xorshift64star/1",
  "structured": [
    {
      "url": "https://example.gov/",
      "cluster_id": "cde6850118e6",
      "reason": "home"
    },
    {
      "url": "https://example.gov/news/2024-budget",
      "cluster_id": "f13dc6bcc68a",
      "reason": "template:f13dc6bcc68a"
    },
    {
      "url": "https://example.gov/programs/p-101",
      "cluster_id": "41ba0aa28e1a",
      "reason": "template:41ba0aa28e1a"
    },
    {
      "url": "https://example.gov/data/q1-2025",
      "cluster_id": "1ce849d86fa4",
      "reason": "template:1ce849d86fa4"
    },
    {
      "url": "https://example.gov/about",
      "cluster_id": "f497ef0b0c31",
      "reason": "unique"
    },
    {
      "url": "https://example.gov/contact",
      "cluster_id": "973adae283cd",
      "reason": "unique"
    },
    {
      "url": "https://example.gov/news/2025-recap",
      "cluster_id": "8c2c9f9746f1",
      "reason": "unique"
    },
    {
      "url": "https://example.gov/reports/annual.pdf",
      "cluster_id": null,
      "reason": "document"
    }
  ],
  "random": [
    {
      "url": "https://example.gov/programs/p-102",
      "cluster_id": "41ba0aa28e1a",
      "in_structured_cluster": true
    },
    {
      "url": "https://example.gov/programs/p-103",
      "cluster_id": "41ba0aa28e1a",
      "in_structured_cluster": true
    },
    {
      "url": "https://example.gov/news/2025-update",
      "cluster_id": "f13dc6bcc68a",
      "in_structured_cluster": true
    }
  ],
  "processes": [],
  "coverage": {
    "discovered": 12,
    "fetched": 12,
    "clustered": 7,
    "sampled_structured": 8,
    "sampled_random": 3,
    "excluded_by_robots": 0,
    "unreachable": 0,
    "off_scope": 1,
    "documents": 1
  },
  "structured_coverage_estimate": 1.0,
  "statement": "A sample never supports a whole-site conformance claim. Results apply to the sampled pages and processes.",
  "partial": false,
  "remaining_work": []
}
