{
  "schema_version": "1.0.0",
  "run_id": "run-2026-10-18-0a1b2c",
  "audit_id": "fixture",
  "method": "wcag-em-2.0",
  "algorithm": "diligent-sampler/1",
  "seed": "run-2026-10-18-0a1b2c",
  "prng": "diligent-xorshift64star/1",
  "structured": [
    {
      "url": "https://example.gov/",
      "cluster_id": "8f306e3de160",
      "reason": "home"
    },
    {
      "url": "https://example.gov/about",
      "cluster_id": "f1e9a4008e24",
      "reason": "unique"
    },
    {
      "url": "https://example.gov/missing",
      "cluster_id": "2c1082625774",
      "reason": "unique"
    },
    {
      "url": "https://example.gov/moved",
      "cluster_id": "2802d3d5aca1",
      "reason": "unique"
    }
  ],
  "random": [],
  "processes": [],
  "coverage": {
    "discovered": 8,
    "fetched": 4,
    "clustered": 4,
    "sampled_structured": 4,
    "sampled_random": 0,
    "excluded_by_robots": 0,
    "unreachable": 4,
    "off_scope": 0,
    "documents": 0
  },
  "structured_coverage_estimate": null,
  "statement": "A sample never supports a whole-site conformance claim. Results apply to the sampled pages and processes.",
  "partial": false,
  "remaining_work": []
}
